{
  "content_id": "lf-short-example",
  "content_type": "short",
  "width": 1080,
  "height": 1920,
  "fps": 30,
  "duration_seconds": 36.6,
  "scenes": [
    {
      "asset": "assets/lf-short-example/scene-01.png",
      "start": 0.0,
      "duration": 3.32,
      "motion": "push_in"
    },
    {
      "asset": "assets/lf-short-example/scene-02.png",
      "start": 3.32,
      "duration": 5.68,
      "motion": "pan_left"
    },
    {
      "asset": "assets/lf-short-example/scene-03.png",
      "start": 9.0,
      "duration": 5.21,
      "motion": "push_out"
    },
    {
      "asset": "assets/lf-short-example/scene-04.png",
      "start": 14.21,
      "duration": 6.16,
      "motion": "pan_right"
    },
    {
      "asset": "assets/lf-short-example/scene-05.png",
      "start": 20.37,
      "duration": 5.21,
      "motion": "parallax"
    },
    {
      "asset": "assets/lf-short-example/scene-06.png",
      "start": 25.58,
      "duration": 5.68,
      "motion": "push_in"
    },
    {
      "asset": "assets/lf-short-example/scene-07.png",
      "start": 31.26,
      "duration": 5.34,
      "motion": "pan_left"
    }
  ],
  "voice": "audio/lf-short-example.wav",
  "subtitles": "subtitles/lf-short-example.json",
  "music": null,
  "sfx": []
}
